{
  "schema_version": "0.1",
  "dataset_version": "dataset-v0.1",
  "case_id": "lr_203",
  "device_id": "CV-01",
  "synthetic": true,
  "window_start": "2026-09-04T08:24:00+08:00",
  "window_end": "2026-09-04T08:26:00+08:00",
  "sample_interval_s": 1,
  "requested_task": "输送段恢复供电后未自行启动，请检查资料并根据实时状态处理。",
  "collection": {
    "telemetry_complete": true,
    "events_complete": true,
    "images_are_video": false,
    "missing_fields": [],
    "uploaded_state_is_live_authority": false
  },
  "input_files": [
    "device.json",
    "device_state.json",
    "data_dictionary.json",
    "operating_guide.md",
    "telemetry.csv",
    "events.jsonl",
    "images.json"
  ]
}
