{
  "schema_version": "0.1",
  "dataset_version": "dataset-v0.1",
  "case_id": "lr_205",
  "device_id": "CV-01",
  "synthetic": true,
  "window_start": "2026-09-06T10:58:00+08:00",
  "window_end": "2026-09-06T11:00:00+08:00",
  "sample_interval_s": 1,
  "requested_task": "停顿前后资料有缺项，当前已有检修登记。请分别说明历史判断和当前是否可操作。",
  "collection": {
    "telemetry_complete": false,
    "events_complete": false,
    "images_are_video": false,
    "missing_fields": [
      "upstream_power_available,drive_power_enabled,drive_supply_voltage_v,drive_ready,production_requested,operating_mode@2026-09-06T10:58:30+08:00..2026-09-06T10:59:39+08:00"
    ],
    "uploaded_state_is_live_authority": false
  },
  "input_files": [
    "device.json",
    "device_state.json",
    "data_dictionary.json",
    "operating_guide.md",
    "telemetry.csv",
    "events.jsonl",
    "images.json"
  ]
}
