{
  "schema_version": "0.1",
  "dataset_version": "dataset-v0.1",
  "case_id": "lr_107",
  "device_id": "CV-01",
  "synthetic": true,
  "window_start": "2026-09-08T08:42:00+08:00",
  "window_end": "2026-09-08T08:44:00+08:00",
  "sample_interval_s": 1,
  "requested_task": "工位短时停电后保持停止。请核对状态，并以最新工具反馈判断下一步。",
  "collection": {
    "telemetry_complete": false,
    "events_complete": true,
    "images_are_video": false,
    "missing_fields": [
      "motor_current_a@2026-09-08T08:42:07+08:00..2026-09-08T08:42:19+08:00"
    ],
    "uploaded_state_is_live_authority": false
  },
  "input_files": [
    "device.json",
    "device_state.json",
    "data_dictionary.json",
    "operating_guide.md",
    "telemetry.csv",
    "events.jsonl",
    "images.json"
  ]
}
